{
  "schema_version": "ce3-onboarding-proposal/1",
  "id": "c1-r1",
  "revision": 1,
  "profile": "fixed-replay/0.1",
  "analysis": {
    "kind": "check",
    "question": "Kan leveransvillkoret för plan P uppfyllas senast dag 3?",
    "plan_ids": [
      "plan_p"
    ],
    "criterion_ids": [
      "criterion_delivery_day3"
    ],
    "changed_assumption_ids": []
  },
  "scope": {
    "includes": [
      "Plan P: bygga en provmodul.",
      "Målet dag 2.",
      "Kravet på ett separat godkännandebesked före leverans.",
      "Kontroll till och med dag 3 med dag 0 som start."
    ],
    "excludes": []
  },
  "sources": [
    {
      "id": "brief",
      "version": 1,
      "kind": "document",
      "original_ref": "synthetic://c1/brief",
      "original_sha256": "b799dbf026a2132d7a4ddd3c60ddbdad3434c0533ba0f2b2871b9c1441678a7c",
      "extraction": "complete",
      "content": "Kontrollera plan P: bygg en provmodul. Förhoppningsvis klart dag 2. Dag 2 är ett mål, inte en garanti. Leverans får ske först efter ansvarigs separata godkännandebesked. Tidpunkten för beskedet är ännu inte angiven. Analysen ska kontrollera om leveransvillkoret kan uppfyllas senast dag 3, med dag 0 som start.",
      "content_sha256": "b799dbf026a2132d7a4ddd3c60ddbdad3434c0533ba0f2b2871b9c1441678a7c",
      "extraction_note": null,
      "trust": "data_only"
    }
  ],
  "items": [
    {
      "id": "plan_p",
      "kind": "plan",
      "statement": "Bygg en provmodul.",
      "type": "user_fact",
      "status": "known",
      "value": "bygg en provmodul",
      "unit": null,
      "refs": [
        {
          "source_id": "brief",
          "source_version": 1,
          "quote": "Kontrollera plan P: bygg en provmodul.",
          "start": 0,
          "end": 38,
          "location": null
        }
      ],
      "depends_on": [],
      "supersedes": [],
      "rationale": "Planen är uttryckligen angiven.",
      "scenario_choice": null
    },
    {
      "id": "goal_module_day2",
      "kind": "value",
      "statement": "Provmodulen är förhoppningsvis klar dag 2.",
      "type": "goal",
      "status": "known",
      "value": 2,
      "unit": "dag",
      "refs": [
        {
          "source_id": "brief",
          "source_version": 1,
          "quote": "Förhoppningsvis klart dag 2.",
          "start": 39,
          "end": 67,
          "location": null
        },
        {
          "source_id": "brief",
          "source_version": 1,
          "quote": "Dag 2 är ett mål, inte en garanti.",
          "start": 68,
          "end": 102,
          "location": null
        }
      ],
      "depends_on": [
        "plan_p"
      ],
      "supersedes": [],
      "rationale": "Dag 2 anges som mål och inte som garanti.",
      "scenario_choice": null
    },
    {
      "id": "rule_approval_before_delivery",
      "kind": "rule",
      "statement": "Leverans får ske först efter ansvarigs separata godkännandebesked.",
      "type": "requirement",
      "status": "known",
      "value": true,
      "unit": null,
      "refs": [
        {
          "source_id": "brief",
          "source_version": 1,
          "quote": "Leverans får ske först efter ansvarigs separata godkännandebesked.",
          "start": 103,
          "end": 169,
          "location": null
        }
      ],
      "depends_on": [],
      "supersedes": [],
      "rationale": "Detta är ett uttryckligt leveransvillkor.",
      "scenario_choice": null
    },
    {
      "id": "rule_approval_time",
      "kind": "rule",
      "statement": "Tidpunkten för godkännandebeskedet är inte angiven.",
      "type": "document_fact",
      "status": "unknown",
      "value": null,
      "unit": null,
      "refs": [
        {
          "source_id": "brief",
          "source_version": 1,
          "quote": "Tidpunkten för beskedet är ännu inte angiven.",
          "start": 170,
          "end": 215,
          "location": null
        }
      ],
      "depends_on": [],
      "supersedes": [],
      "rationale": "Underlaget anger ingen tidpunkt för beskedet.",
      "scenario_choice": null
    },
    {
      "id": "criterion_delivery_day3",
      "kind": "criterion",
      "statement": "Leveransvillkoret ska kontrolleras senast dag 3.",
      "type": "requirement",
      "status": "known",
      "value": 3,
      "unit": "dag",
      "refs": [
        {
          "source_id": "brief",
          "source_version": 1,
          "quote": "Analysen ska kontrollera om leveransvillkoret kan uppfyllas senast dag 3, med dag 0 som start.",
          "start": 216,
          "end": 310,
          "location": null
        }
      ],
      "depends_on": [
        "rule_approval_before_delivery"
      ],
      "supersedes": [],
      "rationale": "Kontrollhorisonten och startdagen är uttryckligen angivna.",
      "scenario_choice": null
    },
    {
      "id": "value_start_day",
      "kind": "value",
      "statement": "Startdagen är dag 0.",
      "type": "document_fact",
      "status": "known",
      "value": 0,
      "unit": "dag",
      "refs": [
        {
          "source_id": "brief",
          "source_version": 1,
          "quote": "med dag 0 som start",
          "start": 290,
          "end": 309,
          "location": null
        }
      ],
      "depends_on": [],
      "supersedes": [],
      "rationale": "Startdagen är angiven i underlaget.",
      "scenario_choice": null
    }
  ],
  "gaps": [
    {
      "id": "gap_delivery_model",
      "item_ids": [
        "plan_p",
        "goal_module_day2",
        "rule_approval_time",
        "criterion_delivery_day3"
      ],
      "kind": "missing_data",
      "impact": "blocks_handoff",
      "status": "open",
      "explanation": "Det saknas uppgifter om när eller hur provmodulen blir klar, när godkännandebeskedet kan ges och hur leverans utförs. Därför kan inget tidsförlopp för kontrollen fastställas.",
      "resolution": null
    }
  ],
  "change": {
    "parent_digest": null,
    "changed_item_ids": [],
    "affected_finding_ids": [],
    "reason": "First live draft; immutable evaluation snapshot."
  }
}
