{
  "schema_version": "ce3-onboarding-proposal/1",
  "id": "c2-r2",
  "revision": 1,
  "profile": "fixed-replay/0.1",
  "analysis": {
    "kind": "choose",
    "question": "Vilken av plan A och plan B ska väljas utifrån lägst total kostnad, bland planer med separat kontrollbesked senast dag 5?",
    "plan_ids": [
      "plan_a",
      "plan_b"
    ],
    "criterion_ids": [
      "criterion_approval_by_day_5",
      "criterion_lowest_total_cost"
    ],
    "changed_assumption_ids": []
  },
  "scope": {
    "includes": [
      "Jämförelse av plan A och plan B.",
      "Krav på separat kontrollbesked.",
      "Godkännande senast dag 5 från start dag 0.",
      "Total kostnad som urvalskriterium."
    ],
    "excludes": []
  },
  "sources": [
    {
      "id": "brief",
      "version": 1,
      "kind": "document",
      "original_ref": "synthetic://c2/brief",
      "original_sha256": "ac7d8c8f3d378368e5290cad0db3519b01bd2d17a305bfc87411fa9c154aad97",
      "extraction": "complete",
      "content": "Jämför plan A (test i egen lokal) med plan B (test i hyrd lokal). Välj efter lägst total kostnad bland planer som blir godkända senast dag 5, räknat från start dag 0. Båda kräver ett separat kontrollbesked. Kostnaden för vardera plan och tidpunkterna för kontrollbeskeden är okända. Inga schablonvärden eller hypotetiska tider har valts.",
      "content_sha256": "ac7d8c8f3d378368e5290cad0db3519b01bd2d17a305bfc87411fa9c154aad97",
      "extraction_note": null,
      "trust": "data_only"
    }
  ],
  "items": [
    {
      "id": "plan_a",
      "kind": "plan",
      "statement": "Plan A är test i egen lokal.",
      "type": "document_fact",
      "status": "known",
      "value": "test i egen lokal",
      "unit": null,
      "refs": [
        {
          "source_id": "brief",
          "source_version": 1,
          "quote": "plan A (test i egen lokal)",
          "start": 7,
          "end": 33,
          "location": null
        }
      ],
      "depends_on": [],
      "supersedes": [],
      "rationale": "En av de två angivna planerna.",
      "scenario_choice": null
    },
    {
      "id": "plan_b",
      "kind": "plan",
      "statement": "Plan B är test i hyrd lokal.",
      "type": "document_fact",
      "status": "known",
      "value": "test i hyrd lokal",
      "unit": null,
      "refs": [
        {
          "source_id": "brief",
          "source_version": 1,
          "quote": "plan B (test i hyrd lokal)",
          "start": 38,
          "end": 64,
          "location": null
        }
      ],
      "depends_on": [],
      "supersedes": [],
      "rationale": "En av de två angivna planerna.",
      "scenario_choice": null
    },
    {
      "id": "criterion_approval_by_day_5",
      "kind": "criterion",
      "statement": "En plan måste bli godkänd senast dag 5, räknat från start dag 0, för att ingå i urvalet.",
      "type": "requirement",
      "status": "known",
      "value": "senast dag 5 från start dag 0",
      "unit": null,
      "refs": [
        {
          "source_id": "brief",
          "source_version": 1,
          "quote": "blir godkända senast dag 5, räknat från start dag 0",
          "start": 114,
          "end": 165,
          "location": null
        }
      ],
      "depends_on": [],
      "supersedes": [],
      "rationale": "Angivet behörighetskrav för urvalet.",
      "scenario_choice": null
    },
    {
      "id": "criterion_lowest_total_cost",
      "kind": "criterion",
      "statement": "Bland godkända planer ska planen med lägst total kostnad väljas.",
      "type": "goal",
      "status": "known",
      "value": "lägst total kostnad",
      "unit": null,
      "refs": [
        {
          "source_id": "brief",
          "source_version": 1,
          "quote": "Välj efter lägst total kostnad bland planer som blir godkända",
          "start": 66,
          "end": 127,
          "location": null
        }
      ],
      "depends_on": [
        "criterion_approval_by_day_5",
        "cost_plan_a",
        "cost_plan_b"
      ],
      "supersedes": [],
      "rationale": "Angivet urvalsmål.",
      "scenario_choice": null
    },
    {
      "id": "rule_separate_control_notice",
      "kind": "rule",
      "statement": "Varje plan kräver ett separat kontrollbesked.",
      "type": "requirement",
      "status": "known",
      "value": true,
      "unit": null,
      "refs": [
        {
          "source_id": "brief",
          "source_version": 1,
          "quote": "Båda kräver ett separat kontrollbesked.",
          "start": 167,
          "end": 206,
          "location": null
        }
      ],
      "depends_on": [
        "plan_a",
        "plan_b"
      ],
      "supersedes": [],
      "rationale": "Gemensamt krav för båda planerna.",
      "scenario_choice": null
    },
    {
      "id": "cost_plan_a",
      "kind": "value",
      "statement": "Den totala kostnaden för plan A är okänd.",
      "type": "document_fact",
      "status": "unknown",
      "value": null,
      "unit": null,
      "refs": [
        {
          "source_id": "brief",
          "source_version": 1,
          "quote": "Kostnaden för vardera plan",
          "start": 207,
          "end": 233,
          "location": null
        },
        {
          "source_id": "brief",
          "source_version": 1,
          "quote": "är okända.",
          "start": 272,
          "end": 282,
          "location": null
        }
      ],
      "depends_on": [
        "plan_a"
      ],
      "supersedes": [],
      "rationale": "Underlaget anger att kostnaden för vardera plan är okänd.",
      "scenario_choice": null
    },
    {
      "id": "cost_plan_b",
      "kind": "value",
      "statement": "Den totala kostnaden för plan B är okänd.",
      "type": "document_fact",
      "status": "unknown",
      "value": null,
      "unit": null,
      "refs": [
        {
          "source_id": "brief",
          "source_version": 1,
          "quote": "Kostnaden för vardera plan",
          "start": 207,
          "end": 233,
          "location": null
        },
        {
          "source_id": "brief",
          "source_version": 1,
          "quote": "är okända.",
          "start": 272,
          "end": 282,
          "location": null
        }
      ],
      "depends_on": [
        "plan_b"
      ],
      "supersedes": [],
      "rationale": "Underlaget anger att kostnaden för vardera plan är okänd.",
      "scenario_choice": null
    },
    {
      "id": "control_notice_time_plan_a",
      "kind": "value",
      "statement": "Tidpunkten för plan A:s kontrollbesked är okänd.",
      "type": "document_fact",
      "status": "unknown",
      "value": null,
      "unit": "dag från start",
      "refs": [
        {
          "source_id": "brief",
          "source_version": 1,
          "quote": "tidpunkterna för kontrollbeskeden är okända.",
          "start": 238,
          "end": 282,
          "location": null
        }
      ],
      "depends_on": [
        "plan_a",
        "rule_separate_control_notice"
      ],
      "supersedes": [],
      "rationale": "Underlaget anger att tidpunkterna för kontrollbeskeden är okända.",
      "scenario_choice": null
    },
    {
      "id": "control_notice_time_plan_b",
      "kind": "value",
      "statement": "Tidpunkten för plan B:s kontrollbesked är okänd.",
      "type": "document_fact",
      "status": "unknown",
      "value": null,
      "unit": "dag från start",
      "refs": [
        {
          "source_id": "brief",
          "source_version": 1,
          "quote": "tidpunkterna för kontrollbeskeden är okända.",
          "start": 238,
          "end": 282,
          "location": null
        }
      ],
      "depends_on": [
        "plan_b",
        "rule_separate_control_notice"
      ],
      "supersedes": [],
      "rationale": "Underlaget anger att tidpunkterna för kontrollbeskeden är okända.",
      "scenario_choice": null
    },
    {
      "id": "rule_no_default_values",
      "kind": "rule",
      "statement": "Inga schablonvärden eller hypotetiska tider har valts.",
      "type": "document_fact",
      "status": "known",
      "value": true,
      "unit": null,
      "refs": [
        {
          "source_id": "brief",
          "source_version": 1,
          "quote": "Inga schablonvärden eller hypotetiska tider har valts.",
          "start": 283,
          "end": 337,
          "location": null
        }
      ],
      "depends_on": [],
      "supersedes": [],
      "rationale": "Förhindrar att saknade kostnader eller tider ersätts med antaganden.",
      "scenario_choice": null
    }
  ],
  "gaps": [
    {
      "id": "gap_costs",
      "item_ids": [
        "cost_plan_a",
        "cost_plan_b",
        "criterion_lowest_total_cost"
      ],
      "kind": "missing_data",
      "impact": "blocks_handoff",
      "status": "open",
      "explanation": "Båda planernas totala kostnader saknas, så lägsta kostnad kan inte fastställas.",
      "resolution": null
    },
    {
      "id": "gap_control_notices",
      "item_ids": [
        "control_notice_time_plan_a",
        "control_notice_time_plan_b",
        "criterion_approval_by_day_5"
      ],
      "kind": "missing_data",
      "impact": "blocks_handoff",
      "status": "open",
      "explanation": "Tidpunkterna för kontrollbeskeden saknas, så det kan inte avgöras om respektive plan blir godkänd senast dag 5.",
      "resolution": null
    }
  ],
  "change": {
    "parent_digest": null,
    "changed_item_ids": [],
    "affected_finding_ids": [],
    "reason": "First live draft; immutable evaluation snapshot."
  }
}
