{
  "schema_version": "ce3-onboarding-proposal/1",
  "id": "c5-r1",
  "revision": 1,
  "profile": "fixed-replay/0.1",
  "analysis": {
    "kind": "check",
    "question": "Bevarar den deklarerade fasta följden villkoret att vara leveransklar senast dag 3?",
    "plan_ids": [
      "plan_p"
    ],
    "criterion_ids": [
      "criterion_delivery_ready_day3"
    ],
    "changed_assumption_ids": []
  },
  "scope": {
    "includes": [
      "Den fasta planen P från dag 0 till och med dag 3.",
      "Kontroll av om leveransklar blir sant senast dag 3."
    ],
    "excludes": [
      "Ekonomi.",
      "Faktisk leverans.",
      "Prognos av verkligt kontrollutfall."
    ]
  },
  "sources": [
    {
      "id": "brief",
      "version": 1,
      "kind": "document",
      "original_ref": "synthetic://c5/brief",
      "original_sha256": "efa65292817a03f432e9df7610d92caf89be99f2a92054ccc49139a8b899ea43",
      "extraction": "complete",
      "content": "Kontrollera enbart denna fasta syntetiska plan P mot kravet att vara leveransklar senast dag 3. Klockan startar dag 0 och slutar dag 3, med heltalsdagar. Tillståndet resultat har värdena väntar, godkänt och underkänt; initialt väntar. Ett enda externt kontrollbesked kommer dag 2 och har för denna uttryckligen fasta analys utfallet godkänt. Beskedet sätter resultat till godkänt. En enda leverans får försökas dag 3, bara om resultat är godkänt, och sätter leveransklar till sant. Leveransklar är initialt falskt och har värdena falskt och sant. Inga andra händelser eller beslut ingår. Ekonomi, faktisk leverans och prognos av verkligt kontrollutfall ligger utanför frågan. Granska bara om denna deklarerade fasta följd bevarar villkoret; begär inte verksamhetsdetaljer utanför avgränsningen.",
      "content_sha256": "efa65292817a03f432e9df7610d92caf89be99f2a92054ccc49139a8b899ea43",
      "extraction_note": null,
      "trust": "data_only"
    }
  ],
  "items": [
    {
      "id": "plan_p",
      "kind": "plan",
      "statement": "Plan P har ett externt kontrollbesked dag 2 och ett leveransförsök dag 3.",
      "type": "document_fact",
      "status": "known",
      "value": "Kontrollbesked dag 2; leveransförsök dag 3",
      "unit": null,
      "refs": [
        {
          "source_id": "brief",
          "source_version": 1,
          "quote": "Ett enda externt kontrollbesked kommer dag 2",
          "start": 235,
          "end": 279,
          "location": null
        },
        {
          "source_id": "brief",
          "source_version": 1,
          "quote": "En enda leverans får försökas dag 3",
          "start": 381,
          "end": 416,
          "location": null
        }
      ],
      "depends_on": [],
      "supersedes": [],
      "rationale": "Den deklarerade fasta följden som ska granskas.",
      "scenario_choice": null
    },
    {
      "id": "criterion_delivery_ready_day3",
      "kind": "criterion",
      "statement": "Leveransklar ska vara sant senast dag 3.",
      "type": "requirement",
      "status": "known",
      "value": true,
      "unit": null,
      "refs": [
        {
          "source_id": "brief",
          "source_version": 1,
          "quote": "kravet att vara leveransklar senast dag 3",
          "start": 53,
          "end": 94,
          "location": null
        }
      ],
      "depends_on": [],
      "supersedes": [],
      "rationale": "Uttryckligt granskningskrav.",
      "scenario_choice": null
    },
    {
      "id": "value_result_initial",
      "kind": "value",
      "statement": "Resultat är initialt väntar.",
      "type": "document_fact",
      "status": "known",
      "value": "väntar",
      "unit": null,
      "refs": [
        {
          "source_id": "brief",
          "source_version": 1,
          "quote": "initialt väntar",
          "start": 218,
          "end": 233,
          "location": null
        }
      ],
      "depends_on": [],
      "supersedes": [],
      "rationale": "Initialvärde för resultat.",
      "scenario_choice": null
    },
    {
      "id": "rule_result_domain",
      "kind": "rule",
      "statement": "Resultat har värdena väntar, godkänt och underkänt.",
      "type": "document_fact",
      "status": "known",
      "value": "väntar, godkänt, underkänt",
      "unit": null,
      "refs": [
        {
          "source_id": "brief",
          "source_version": 1,
          "quote": "Tillståndet resultat har värdena väntar, godkänt och underkänt",
          "start": 154,
          "end": 216,
          "location": null
        }
      ],
      "depends_on": [],
      "supersedes": [],
      "rationale": "Deklarerad värdemängd.",
      "scenario_choice": null
    },
    {
      "id": "value_delivery_ready_initial",
      "kind": "value",
      "statement": "Leveransklar är initialt falskt.",
      "type": "document_fact",
      "status": "known",
      "value": false,
      "unit": null,
      "refs": [
        {
          "source_id": "brief",
          "source_version": 1,
          "quote": "Leveransklar är initialt falskt",
          "start": 482,
          "end": 513,
          "location": null
        }
      ],
      "depends_on": [],
      "supersedes": [],
      "rationale": "Initialvärde för leveransklar.",
      "scenario_choice": null
    },
    {
      "id": "rule_delivery_ready_domain",
      "kind": "rule",
      "statement": "Leveransklar har värdena falskt och sant.",
      "type": "document_fact",
      "status": "known",
      "value": "falskt, sant",
      "unit": null,
      "refs": [
        {
          "source_id": "brief",
          "source_version": 1,
          "quote": "har värdena falskt och sant",
          "start": 518,
          "end": 545,
          "location": null
        }
      ],
      "depends_on": [],
      "supersedes": [],
      "rationale": "Deklarerad värdemängd.",
      "scenario_choice": null
    },
    {
      "id": "rule_review_event",
      "kind": "rule",
      "statement": "Det externa kontrollbeskedet dag 2 sätter resultat till godkänt.",
      "type": "document_fact",
      "status": "known",
      "value": "resultat=godkänt",
      "unit": null,
      "refs": [
        {
          "source_id": "brief",
          "source_version": 1,
          "quote": "Beskedet sätter resultat till godkänt.",
          "start": 342,
          "end": 380,
          "location": null
        }
      ],
      "depends_on": [
        "plan_p"
      ],
      "supersedes": [],
      "rationale": "Fast externt utfall och effekt i planen.",
      "scenario_choice": null
    },
    {
      "id": "rule_delivery_attempt",
      "kind": "rule",
      "statement": "Leveransförsöket dag 3 är tillåtet bara om resultat är godkänt och sätter leveransklar till sant.",
      "type": "document_fact",
      "status": "known",
      "value": "om resultat=godkänt, leveransklar=sant",
      "unit": null,
      "refs": [
        {
          "source_id": "brief",
          "source_version": 1,
          "quote": "En enda leverans får försökas dag 3, bara om resultat är godkänt, och sätter leveransklar till sant.",
          "start": 381,
          "end": 481,
          "location": null
        }
      ],
      "depends_on": [
        "plan_p",
        "rule_review_event"
      ],
      "supersedes": [],
      "rationale": "Villkor och effekt för leveransförsöket.",
      "scenario_choice": null
    },
    {
      "id": "rule_no_other_actions",
      "kind": "rule",
      "statement": "Inga andra händelser eller beslut ingår.",
      "type": "document_fact",
      "status": "known",
      "value": true,
      "unit": null,
      "refs": [
        {
          "source_id": "brief",
          "source_version": 1,
          "quote": "Inga andra händelser eller beslut ingår.",
          "start": 547,
          "end": 587,
          "location": null
        }
      ],
      "depends_on": [
        "plan_p"
      ],
      "supersedes": [],
      "rationale": "Avgränsar den fasta följden.",
      "scenario_choice": null
    },
    {
      "id": "value_clock",
      "kind": "value",
      "statement": "Klockan går från dag 0 till och med dag 3 med heltalsdagar.",
      "type": "document_fact",
      "status": "known",
      "value": "0..3",
      "unit": "dag",
      "refs": [
        {
          "source_id": "brief",
          "source_version": 1,
          "quote": "Klockan startar dag 0 och slutar dag 3, med heltalsdagar.",
          "start": 96,
          "end": 153,
          "location": null
        }
      ],
      "depends_on": [],
      "supersedes": [],
      "rationale": "Tidsram för granskningen.",
      "scenario_choice": null
    }
  ],
  "gaps": [],
  "change": {
    "parent_digest": null,
    "changed_item_ids": [],
    "affected_finding_ids": [],
    "reason": "First live draft; immutable evaluation snapshot."
  }
}
